,product_id,product_name,product_link,product_price,product_old_price,product_discount,Date
0,GE779EA2AIOSPNAFAMZ,High Quality Mini Tripod Deskphoto Stand Clip Selfie Tool,https://www.jumia.com.ng/generic-high-quality-mini-tripod-deskphoto-stand-clip-selfie-tool-175400683.html,"₦ 13,414","₦ 18,828",29%,2022-11-03 23:32:40.157078
1,GE779EA20O4IKNAFAMZ,Cadiso Portable Ocus Tripod Flexible Travel Mini Tripod,https://www.jumia.com.ng/generic-cadiso-portable-ocus-tripod-flexible-travel-mini-tripod-184975022.html,"₦ 23,098","₦ 44,196",48%,2022-11-03 23:32:40.709164
2,GE779EA2MXFGKNAFAMZ,Mini Tripod For Camera Tripode For Iphone 6s 7 Xiaomi With,https://www.jumia.com.ng/generic-mini-tripod-for-camera-tripode-for-iphone-6s-7-xiaomi-with-188534495.html,"₦ 10,912 - ₦ 11,145","₦ 18,824 - ₦ 19,290",42%,2022-11-03 23:32:40.986852
3,GE779EA39UODXNAFAMZ,2kg Strong Load 1/4 Standard Camera Screw Absmetal Black,https://www.jumia.com.ng/generic-2kg-strong-load-14-standard-camera-screw-absmetal-black-175364979.html,"₦ 11,761","₦ 17,522",33%,2022-11-03 23:32:41.217101
4,GE779EA2368CCNAFAMZ,Ulanzi 2 Pcs Tripod: 1 Pcs Mt-08 Desk Mini Portable Tripod,https://www.jumia.com.ng/generic-ulanzi-2-pcs-tripod-1-pcs-mt-08-desk-mini-portable-tripod-184916262.html,"₦ 22,745","₦ 43,490",48%,2022-11-03 23:32:41.519061
5,GE779EA29PSO1NAFAMZ,Professional Tripod Foldable Camera Holder Stand Screw Stabilizer Tripod For NikonSony IPhone Xiaomi Samsung YI,https://www.jumia.com.ng/generic-professional-tripod-foldable-camera-holder-stand-screw-stabilizer-tripod-for-nikonsony-iphone-xiaomi-samsung-yi-194425273.html,"₦ 24,690","₦ 42,568",42%,2022-11-03 23:32:41.680609
6,GE779EA1RR774NAFAMZ,Beiyang Tripod Mount Adapter Cell Phone Clipper Holder 360,https://www.jumia.com.ng/generic-beiyang-tripod-mount-adapter-cell-phone-clipper-holder-360-184848070.html,"₦ 12,157","₦ 22,314",46%,2022-11-03 23:32:41.832082
7,GE779EA2B5MIKNAFAMZ,Lightweight Tripod Phone Holder For Samsung Note 10 Iphone,https://www.jumia.com.ng/generic-lightweight-tripod-phone-holder-for-samsung-note-10-iphone-188507693.html,"₦ 24,098","₦ 45,196",47%,2022-11-03 23:32:42.000557
8,GE779EA1QKAISNAFAMZ,Projector Tripod Holder Bracket Stand Floor Stand Tripod,https://www.jumia.com.ng/generic-projector-tripod-holder-bracket-stand-floor-stand-tripod-184928050.html,"₦ 10,992","₦ 19,984",45%,2022-11-03 23:32:42.151255
9,GE779EA1VDC05NAFAMZ,Selens Stainless Steel T Flash Lamp Lamp Stand Tripod Flash,https://www.jumia.com.ng/generic-selens-stainless-steel-t-flash-lamp-lamp-stand-tripod-flash-175365131.html,"₦ 17,598","₦ 32,196",45%,2022-11-03 23:32:42.324826
10,GE779EA2ABVT0NAFAMZ,"Professional Foldable Camera Tripod Holder Stand 1/4"" Screw",https://www.jumia.com.ng/generic-professional-foldable-camera-tripod-holder-stand-14-screw-184928283.html,"₦ 12,087","₦ 22,174",45%,2022-11-03 23:32:42.459596
11,GE779EA3B25KWNAFAMZ,High Quality Professional Phone Tripod Photographic Stand,https://www.jumia.com.ng/generic-high-quality-professional-phone-tripod-photographic-stand-184847999.html,"₦ 10,272","₦ 18,544",45%,2022-11-03 23:32:42.599530
12,GE779EA27GM4WNAFAMZ,Mini Aluminum Tripod Stabilizer With 360～fluid Head Camera,https://www.jumia.com.ng/generic-mini-aluminum-tripod-stabilizer-with-360fluid-head-camera-184846433.html,"₦ 10,025","₦ 18,050",44%,2022-11-03 23:32:42.751076
13,GE779EA2UQ6WWNAFAMZ,Mini Camera Tripod Stand Holder 3110 Aluminum Professional,https://www.jumia.com.ng/generic-mini-camera-tripod-stand-holder-3110-aluminum-professional-184824527.html,"₦ 30,369","₦ 58,738",48%,2022-11-03 23:32:42.935108
14,GE779EA2ECPMINAFAMZ,Bexin Ms02 Portable Folding Ultra Aluminum Plastic Compact,https://www.jumia.com.ng/generic-bexin-ms02-portable-folding-ultra-aluminum-plastic-compact-185004054.html,"₦ 30,171","₦ 58,342",48%,2022-11-03 23:32:43.141175
15,GE779EA1Q4A6HNAFAMZ,Multifunctional Tripod Foldable Wireless BT Selfie Stick,https://www.jumia.com.ng/generic-multifunctional-tripod-foldable-wireless-bt-selfie-stick-190063340.html,"₦ 8,000","₦ 15,900",50%,2022-11-03 23:32:43.340022
16,GE779EA22GE3PNAFAMZ,6.25 Inch Ring Light Promise Dimming Live Fill Light Mobile,https://www.jumia.com.ng/generic-6.25-inch-ring-light-promise-dimming-live-fill-light-mobile-175365052.html,"₦ 22,710","₦ 42,420",46%,2022-11-03 23:32:43.530285
17,GE779EA255SCPNAFAMZ,Mini Table Tripod For Smartphone Clip Holder For Iphone,https://www.jumia.com.ng/generic-mini-table-tripod-for-smartphone-clip-holder-for-iphone-175400692.html,"₦ 13,805","₦ 19,610",30%,2022-11-03 23:32:43.715255
18,GE779EA1XXGQONAFAMZ,Ulanzi U-Grip Triple Shoes Mount Video Action Stabilizing 8,https://www.jumia.com.ng/generic-ulanzi-u-grip-triple-shoes-mount-video-action-stabilizing-8-184845471.html,"₦ 23,105","₦ 44,210",48%,2022-11-03 23:32:43.907649
19,GE779EA22169HNAFAMZ,Desk Tripod Extensionable Stand Adjustable Handheld Tripod,https://www.jumia.com.ng/generic-desk-tripod-extensionable-stand-adjustable-handheld-tripod-175364342.html,"₦ 9,532","₦ 16,064",41%,2022-11-03 23:32:44.086920
20,GE779EA1QWWZWNAFAMZ,Led Video Ring Light With Stand Phone Holder Ringlight For,https://www.jumia.com.ng/generic-led-video-ring-light-with-stand-phone-holder-ringlight-for-184917650.html,"₦ 22,823 - ₦ 29,734","₦ 43,646 - ₦ 57,468",48%,2022-11-03 23:32:44.286731
21,GE779EA3AG92SNAFAMZ,"1/4"" Desk Tripod Handheld Gimbal Support For Ronin Osmo G6",https://www.jumia.com.ng/generic-14-desk-tripod-handheld-gimbal-support-for-ronin-osmo-g6-184925989.html,"₦ 11,600","₦ 21,200",45%,2022-11-03 23:32:44.482426
22,GE779EA2K4YDKNAFAMZ,Portable Mini Travel Flexible Table Tripod Stands Holder,https://www.jumia.com.ng/generic-portable-mini-travel-flexible-table-tripod-stands-holder-184855745.html,"₦ 10,258","₦ 18,516",45%,2022-11-03 23:32:44.705126
23,GE779EA1P6MMWNAFAMZ,Flexible Sponge Ocus Tripod Holder Bracket For Huawei 10,https://www.jumia.com.ng/generic-flexible-sponge-ocus-tripod-holder-bracket-for-huawei-10-184856720.html,"₦ 11,642","₦ 21,284",45%,2022-11-03 23:32:44.949435
24,GE779EA3AMW9WNAFAMZ,1 Pc Portable Metal Mini Light Table Stand Tripod Grip For,https://www.jumia.com.ng/generic-1-pc-portable-metal-mini-light-table-stand-tripod-grip-for-184926299.html,"₦ 9,312","₦ 16,624",44%,2022-11-03 23:32:45.175655
25,GE779EA2PBN20NAFAMZ,Aluminum Mini Table Tripod Light Stand Extendable Online,https://www.jumia.com.ng/generic-aluminum-mini-table-tripod-light-stand-extendable-online-184856436.html,"₦ 10,364","₦ 18,728",45%,2022-11-03 23:32:45.360616
26,GE779EA2C7MRSNAFAMZ,Funsnap Tripods Tripod For Phone Mobile Camera Holder Clip,https://www.jumia.com.ng/generic-funsnap-tripods-tripod-for-phone-mobile-camera-holder-clip-184834414.html,"₦ 10,018","₦ 18,036",44%,2022-11-03 23:32:45.567147
27,GE779EA2W5QP8NAFAMZ,Andoer Mini Tripod Tablephone Camera Tripod Removable Ball,https://www.jumia.com.ng/generic-andoer-mini-tripod-tablephone-camera-tripod-removable-ball-184974947.html,"₦ 22,604","₦ 43,208",48%,2022-11-03 23:32:45.775160
28,GE779EA2D96MGNAFAMZ,1pc Cell Phone Bracket Mini Mobile Phone Tripod Bracket For,https://www.jumia.com.ng/generic-1pc-cell-phone-bracket-mini-mobile-phone-tripod-bracket-for-184859134.html,"₦ 9,524","₦ 17,048",44%,2022-11-03 23:32:45.970706
29,GE779EA396O6TNAFAMZ,Photography Tripod For Mobile Phone With Ring Lamp Camara,https://www.jumia.com.ng/generic-photography-tripod-for-mobile-phone-with-ring-lamp-camara-175362869.html,"₦ 21,679","₦ 40,358",46%,2022-11-03 23:32:46.158873
30,GE779EA35R5T4NAFAMZ,Mini Tripod For Cameras Phone Projector Telescope Portable,https://www.jumia.com.ng/generic-mini-tripod-for-cameras-phone-projector-telescope-portable-184836019.html,"₦ 9,771","₦ 17,542",44%,2022-11-03 23:32:46.359037
31,GE779EA2I4NTWNAFAMZ,Projector Stand Multi-Function Stand Suitable For Live With,https://www.jumia.com.ng/generic-projector-stand-multi-function-stand-suitable-for-live-with-184928315.html,"₦ 20,896","₦ 39,792",47%,2022-11-03 23:32:46.529081
32,GE779EA33PVOWNAFAMZ,Multifunctional Mini Tripod Plastic Selfie Stick Portable,https://www.jumia.com.ng/generic-multifunctional-mini-tripod-plastic-selfie-stick-portable-184844678.html,"₦ 10,865","₦ 19,730",45%,2022-11-03 23:32:46.721254
33,GE779EA1RG2J8NAFAMZ,Ulanzi Mt-11 Flexible Tripod Smartphone Ocus Tripod Vlog,https://www.jumia.com.ng/generic-ulanzi-mt-11-flexible-tripod-smartphone-ocus-tripod-vlog-188556560.html,"₦ 24,480","₦ 45,960",47%,2022-11-03 23:32:46.884023
34,GE779EA2JJGJ8NAFAMZ,Andoer Mini Tripod Stand 1/4 Inch Screw With Remote Shutter,https://www.jumia.com.ng/generic-andoer-mini-tripod-stand-14-inch-screw-with-remote-shutter-184925735.html,"₦ 21,341","₦ 40,682",48%,2022-11-03 23:32:47.053984
35,GE779EA20D328NAFAMZ,Photography Adjustable Table Mini Monopod Set Aluminum Clip,https://www.jumia.com.ng/generic-photography-adjustable-table-mini-monopod-set-aluminum-clip-184824512.html,"₦ 23,105","₦ 44,210",48%,2022-11-03 23:32:47.214107
36,GE779EA2S02I8NAFAMZ,Gekkopod Tripod Flexible Mount Holder Shutter Release For 8,https://www.jumia.com.ng/generic-gekkopod-tripod-flexible-mount-holder-shutter-release-for-8-184846976.html,"₦ 20,592","₦ 39,184",47%,2022-11-03 23:32:47.371578
37,GE779EA1R7WR4NAFAMZ,Bexin Telescopic Handheld Pole Walk Stick Lightweight Video,https://www.jumia.com.ng/generic-bexin-telescopic-handheld-pole-walk-stick-lightweight-video-184848160.html,"₦ 23,105","₦ 44,210",48%,2022-11-03 23:32:47.527319
38,GE779EA2ZFKPGNAFAMZ,Xt-09 Bluetooth Selfie Stick Tripod With Remote Outdoor Kit,https://www.jumia.com.ng/generic-xt-09-bluetooth-selfie-stick-tripod-with-remote-outdoor-kit-188554408.html,"₦ 17,661","₦ 32,322",45%,2022-11-03 23:32:47.682593
39,GE779EA29XIR4NAFAMZ,M L Medium Large Size Camera Gorillapod Tripods Stand Mini,https://www.jumia.com.ng/generic-m-l-medium-large-size-camera-gorillapod-tripods-stand-mini-184821673.html,"₦ 22,315","₦ 42,630",48%,2022-11-03 23:32:47.841292
40,GE779EA2JNQ30NAFAMZ,15cm Long Double Socket Arm For Ram 1-Inch Ball Bases Mount,https://www.jumia.com.ng/generic-15cm-long-double-socket-arm-for-ram-1-inch-ball-bases-mount-184915935.html,"₦ 29,070","₦ 56,140",48%,2022-11-03 23:32:48.009846
41,GE779EA26SW1ONAFAMZ,Universal Metal Adjustable 360 Degree Rotatable Smart Phone,https://www.jumia.com.ng/generic-universal-metal-adjustable-360-degree-rotatable-smart-phone-184975323.html,"₦ 23,254","₦ 44,508",48%,2022-11-03 23:32:48.176585
42,GE779EA2L4F2XNAFAMZ,Fusitu Sponge Flexible Gorillapod Ocus Mini Tripod Stand,https://www.jumia.com.ng/generic-fusitu-sponge-flexible-gorillapod-ocus-mini-tripod-stand-175401465.html,"₦ 17,398","₦ 31,796",45%,2022-11-03 23:32:48.340303
43,GE779EA2CJFAINAFAMZ,"Wireless BT Remote Tripod Blog Portable Live Videos,YouTube Selfie Stick",https://www.jumia.com.ng/generic-wireless-bt-remote-tripod-blog-portable-live-videosyoutube-selfie-stick-162049914.html,"₦ 4,200","₦ 7,900",47%,2022-11-03 23:32:48.495075
44,GE779EA0HBAV3NAFAMZ,Tripod Stand Phone Holder Camera Stand With Remote Shutter,https://www.jumia.com.ng/generic-tripod-stand-phone-holder-camera-stand-with-remote-shutter-76708092.html,"₦ 4,999","₦ 8,076",38%,2022-11-03 23:32:48.649332
45,GE779EA1RN97PNAFAMZ,Outdoor Indoor Portable Stand=Tripod + Mobile Phone Clip + Remote Control,https://www.jumia.com.ng/generic-outdoor-indoor-portable-standtripod-mobile-phone-clip-remote-control-173800960.html,"₦ 6,499","₦ 12,997",50%,2022-11-03 23:32:48.813185
46,GE779EA26J17HNAFAMZ,Portable 360 Degree Rotation Tripod Phone Mount Holder,https://www.jumia.com.ng/generic-portable-360-degree-rotation-tripod-phone-mount-holder-177089813.html,"₦ 3,260","₦ 6,392",49%,2022-11-03 23:32:48.968874
47,GE779EA34C2D9NAFAMZ,Mobile Phone Clip Holder Bracket For Smartphones - Black,https://www.jumia.com.ng/generic-mobile-phone-clip-holder-bracket-for-smartphones-black-133997688.html,"₦ 1,447","₦ 2,400",40%,2022-11-03 23:32:49.154046
48,AR833EA1B1ZOHNAFAMZ,ARHANORY Phone Tripod Stand Ring Light Phones Selfie Stick Live Bracket Spin Desktop Stabilizer Clip Black,https://www.jumia.com.ng/arhanory-phone-tripod-stand-ring-light-phones-selfie-stick-live-bracket-spin-desktop-stabilizer-clip-black-94843097.html,"₦ 1,800","₦ 3,529",49%,2022-11-03 23:32:49.324169
49,AR833EA1KSLUTNAFAMZ,ARHANORY Phone Holder Tripod Stand With Ring Light Selfie Tiktok-Black,https://www.jumia.com.ng/arhanory-phone-holder-tripod-stand-with-ring-light-selfie-tiktok-black-98139359.html,"₦ 2,900","₦ 6,900",58%,2022-11-03 23:32:49.488851
