,product_id,product_name,product_link,product_price,product_old_price,product_discount,Date
0,GE779EA2BR5EONAFAMZ,Komery Tripod Holder Portable Professional Camera Tripod,https://www.jumia.com.ng/generic-komery-tripod-holder-portable-professional-camera-tripod-184847604.html,"₦ 23,098","₦ 44,196",48%,2022-11-03 23:31:16.756663
1,GE779EA2QGCC0NAFAMZ,Mini Aluminum Tripod Stabilizer With 360～fluid Head Camera,https://www.jumia.com.ng/generic-mini-aluminum-tripod-stabilizer-with-360fluid-head-camera-184846356.html,"₦ 9,044","₦ 16,088",44%,2022-11-03 23:31:17.075383
2,GE779EA23GNCCNAFAMZ,Ulanzi Mt-11 Flexible Ocus Tripod Stand 1/4 Inch Screw,https://www.jumia.com.ng/generic-ulanzi-mt-11-flexible-ocus-tripod-stand-14-inch-screw-184974762.html,"₦ 22,456","₦ 42,912",48%,2022-11-03 23:31:17.419919
3,GE779EA2JLD7GNAFAMZ,Ulanzi Adjustable Tripod Mount Adapter Vertical 360 Phone,https://www.jumia.com.ng/generic-ulanzi-adjustable-tripod-mount-adapter-vertical-360-phone-184914835.html,"₦ 28,392","₦ 54,784",48%,2022-11-03 23:31:17.586848
4,GE779EA24DJR8NAFAMZ,Ulanzi Mt-11 Flexible Ocus Tripod For Canon Nikon Dslr 1/4,https://www.jumia.com.ng/generic-ulanzi-mt-11-flexible-ocus-tripod-for-canon-nikon-dslr-14-184928282.html,"₦ 23,381","₦ 44,762",48%,2022-11-03 23:31:17.908905
5,GE779EA33ZB74NAFAMZ,Beiyang Tripod Mount Adapter Cell Phone Clipper Holder 360,https://www.jumia.com.ng/generic-beiyang-tripod-mount-adapter-cell-phone-clipper-holder-360-184848088.html,"₦ 11,098","₦ 20,196",45%,2022-11-03 23:31:18.222204
6,GE779EA1VSJG8NAFAMZ,16cm Led Selfie Ring Light Dimmable Lamp With Cradle Mini,https://www.jumia.com.ng/generic-16cm-led-selfie-ring-light-dimmable-lamp-with-cradle-mini-184856831.html,"₦ 16,322","₦ 30,644",47%,2022-11-03 23:31:18.415092
7,GE779EA31NZOWNAFAMZ,Jumpflash Flexible Sponge Ocus Tripod For Iphone Samsung,https://www.jumia.com.ng/generic-jumpflash-flexible-sponge-ocus-tripod-for-iphone-samsung-188479148.html,"₦ 11,308","₦ 19,616",42%,2022-11-03 23:31:18.587260
8,GE779EA1VK4ACNAFAMZ,Mini Tripod Lightweight Flexible Extendable Stand For Dslr,https://www.jumia.com.ng/generic-mini-tripod-lightweight-flexible-extendable-stand-for-dslr-184927431.html,"₦ 10,371 - ₦ 10,901","₦ 18,742 - ₦ 19,802",45%,2022-11-03 23:31:18.776457
9,GE779EA1QSFQCNAFAMZ,Tablet Stand Bracket Makeup Mirror Ball Head Tripod Led,https://www.jumia.com.ng/generic-tablet-stand-bracket-makeup-mirror-ball-head-tripod-led-184926450.html,"₦ 9,023 - ₦ 12,016","₦ 16,046 - ₦ 22,032",45%,2022-11-03 23:31:18.978213
10,GE779EA2OU9A8NAFAMZ,Slr Dvd Dc 1100 Portable Universal Stick Standing Tripod,https://www.jumia.com.ng/generic-slr-dvd-dc-1100-portable-universal-stick-standing-tripod-184845626.html,"₦ 13,964","₦ 25,928",46%,2022-11-03 23:31:19.173793
11,GE779EA25GZFKNAFAMZ,Gaqou Mini Ocus Tripod Bracket Portable Flexible Phone,https://www.jumia.com.ng/generic-gaqou-mini-ocus-tripod-bracket-portable-flexible-phone-184822103.html,"₦ 11,543","₦ 21,086",45%,2022-11-03 23:31:19.446304
12,GE779EA2WLGS4NAFAMZ,S Code Advanced Mobile Phone Tripod Elastic Wireless Remote,https://www.jumia.com.ng/generic-s-code-advanced-mobile-phone-tripod-elastic-wireless-remote-188518657.html,"₦ 12,049","₦ 21,098",43%,2022-11-03 23:31:19.625755
13,GE779EA2UR3BKNAFAMZ,Ulanzi Tt20s 2 In 1 Mini Table Flexible Dslr Tripod With,https://www.jumia.com.ng/generic-ulanzi-tt20s-2-in-1-mini-table-flexible-dslr-tripod-with-184848527.html,"₦ 23,105","₦ 44,210",48%,2022-11-03 23:31:19.795431
14,GE779EA1V2QIKNAFAMZ,Tripod For Phone With Remote Control Holder Stand Tripod,https://www.jumia.com.ng/generic-tripod-for-phone-with-remote-control-holder-stand-tripod-184916621.html,"₦ 29,480","₦ 56,960",48%,2022-11-03 23:31:20.009800
15,GE779EA2BIKRKNAFAMZ,2 In 1 Tripods Tripod For Phone Mobile Camera Holder Clip,https://www.jumia.com.ng/generic-2-in-1-tripods-tripod-for-phone-mobile-camera-holder-clip-184847204.html,"₦ 11,607","₦ 21,214",45%,2022-11-03 23:31:20.249790
16,GE779EA2FINZKNAFAMZ,Funsnap Tripod For Phone Smartphone Camera Tripod Stand For,https://www.jumia.com.ng/generic-funsnap-tripod-for-phone-smartphone-camera-tripod-stand-for-188479964.html,"₦ 9,289","₦ 15,578",40%,2022-11-03 23:31:20.452320
17,GE779EA2PAY5WNAFAMZ,Puluz Mobile Phone Live Set Pocket Self-Timer Fill Light,https://www.jumia.com.ng/generic-puluz-mobile-phone-live-set-pocket-self-timer-fill-light-188533436.html,"₦ 23,392","₦ 43,784",47%,2022-11-03 23:31:20.636752
18,GE779EA21LLVXNAFAMZ,Octopus Ring Light Mobile Phone Tripod Remote Control,https://www.jumia.com.ng/generic-octopus-ring-light-mobile-phone-tripod-remote-control-190102632.html,"₦ 13,590","₦ 27,170",50%,2022-11-03 23:31:20.824450
19,GE779EA2JYVBGNAFAMZ,Wt3130 Aluminum Alloy Camera Tripod Stand With Rocker Arm,https://www.jumia.com.ng/generic-wt3130-aluminum-alloy-camera-tripod-stand-with-rocker-arm-184917445.html,"₦ 23,105","₦ 44,210",48%,2022-11-03 23:31:21.034722
20,GE779EA2GG0VSNAFAMZ,Professional Portable Foldable Camera Tripod Holder Phone,https://www.jumia.com.ng/generic-professional-portable-foldable-camera-tripod-holder-phone-184835584.html,"₦ 15,969","₦ 29,938",47%,2022-11-03 23:31:21.259647
21,GE779EA2KNBN4NAFAMZ,Cima Pro Rm-30ii Travel Outdoor Mini Bracket Stand Ocus,https://www.jumia.com.ng/generic-cima-pro-rm-30ii-travel-outdoor-mini-bracket-stand-ocus-184821655.html,"₦ 23,105","₦ 44,210",48%,2022-11-03 23:31:21.490125
22,GE779EA2EIBF8NAFAMZ,Tenenele Sponge Flexible Ocus Tripod For Digital Dslr,https://www.jumia.com.ng/generic-tenenele-sponge-flexible-ocus-tripod-for-digital-dslr-188510354.html,"₦ 14,985","₦ 26,970",44%,2022-11-03 23:31:21.659848
23,GE779EA2A9B7ONAFAMZ,Portable Mini Phone Tripod For Camera Phonetripod Mount For,https://www.jumia.com.ng/generic-portable-mini-phone-tripod-for-camera-phonetripod-mount-for-184926183.html,"₦ 9,044","₦ 16,088",44%,2022-11-03 23:31:21.873227
24,GE779EA2ZA3Y4NAFAMZ,Eastvita Mini Portable Flexible Tripod And Phone Holder Kit,https://www.jumia.com.ng/generic-eastvita-mini-portable-flexible-tripod-and-phone-holder-kit-188509108.html,"₦ 11,047","₦ 19,094",42%,2022-11-03 23:31:22.064813
25,GE779EA25GDTSNAFAMZ,Photography L Mic Stand Bracket With 2 Standard Shoe Mounts,https://www.jumia.com.ng/generic-photography-l-mic-stand-bracket-with-2-standard-shoe-mounts-184849003.html,"₦ 20,811","₦ 39,622",47%,2022-11-03 23:31:22.242208
26,GE779EA2NHTGGNAFAMZ,Adjustable Tripod Mount Adapter Vertical 360 Rotation Phone,https://www.jumia.com.ng/generic-adjustable-tripod-mount-adapter-vertical-360-rotation-phone-184849306.html,"₦ 30,362","₦ 58,724",48%,2022-11-03 23:31:22.434662
27,GE779EA2HK3S8NAFAMZ,Mt26xt15 High Bearing Deskbracket Mini Tabletripod And Ball,https://www.jumia.com.ng/generic-mt26xt15-high-bearing-deskbracket-mini-tabletripod-and-ball-184832405.html,"₦ 23,804","₦ 45,608",48%,2022-11-03 23:31:22.610904
28,GE779EA1U23UCNAFAMZ,Desk Tripod Extensionable Stand Adjustable Handheld Tripod,https://www.jumia.com.ng/generic-desk-tripod-extensionable-stand-adjustable-handheld-tripod-184925901.html,"₦ 11,444","₦ 20,888",45%,2022-11-03 23:31:22.768708
29,GE779EA2D6C2SNAFAMZ,2 In 1 Portable Flexible Tripod Phone Table 360 Rotation,https://www.jumia.com.ng/generic-2-in-1-portable-flexible-tripod-phone-table-360-rotation-184926034.html,"₦ 22,512","₦ 43,024",48%,2022-11-03 23:31:22.931144
30,GE779EA2A534ONAFAMZ,65mm Or 95mm Short Long Double Socket Arm For 1 Inch Ball,https://www.jumia.com.ng/generic-65mm-or-95mm-short-long-double-socket-arm-for-1-inch-ball-184856973.html,"₦ 9,778","₦ 17,556",44%,2022-11-03 23:31:23.088975
31,GE779EA1VNSXCNAFAMZ,Yungteng 228 Mini Tripod Triped Phone Holder Clip For Mini,https://www.jumia.com.ng/generic-yungteng-228-mini-tripod-triped-phone-holder-clip-for-mini-184844631.html,"₦ 15,757","₦ 29,514",47%,2022-11-03 23:31:23.254718
32,GE779EA25WWQGNAFAMZ,Ulanzi Smartphone Filmmaker Video Rig Metal Phone Tripod,https://www.jumia.com.ng/generic-ulanzi-smartphone-filmmaker-video-rig-metal-phone-tripod-184856803.html,"₦ 31,138","₦ 60,276",48%,2022-11-03 23:31:23.442195
33,GE779EA300W1MNAFAMZ,Cool Dier 1/4 Screw 360 Rotatable Bicycle Handlebar Clamp,https://www.jumia.com.ng/generic-cool-dier-14-screw-360-rotatable-bicycle-handlebar-clamp-185004418.html,"₦ 11,550 - ₦ 12,115","₦ 21,100 - ₦ 22,230",46%,2022-11-03 23:31:23.609939
34,GE779EA1RUSIPNAFAMZ,SmallRig Octopod Tripod Selection Portable Flexible For IPhone 13 Pro Mini Camera Tripod Phone Holder Clip Stand DT-01 3255,https://www.jumia.com.ng/generic-smallrig-octopod-tripod-selection-portable-flexible-for-iphone-13-pro-mini-camera-tripod-phone-holder-clip-stand-dt-01-3255-194425270.html,"₦ 28,190","₦ 48,603",42%,2022-11-03 23:31:23.851049
35,GE779EA1ST3H0NAFAMZ,Fangtuosi Portable Mini Tripod Handheld Foldable Phone For,https://www.jumia.com.ng/generic-fangtuosi-portable-mini-tripod-handheld-foldable-phone-for-184925880.html,"₦ 10,357 - ₦ 11,155","₦ 18,714 - ₦ 20,310",45%,2022-11-03 23:31:24.038985
36,GE779EA3AV5CCNAFAMZ,Bluetooth Selfie Stick Portable Telescopic Handheld Smart,https://www.jumia.com.ng/generic-bluetooth-selfie-stick-portable-telescopic-handheld-smart-184974699.html,"₦ 23,105","₦ 44,210",48%,2022-11-03 23:31:24.328406
37,GE779EA1VD5IKNAFAMZ,"Tripod Mount Adapter 6.8"" Cell Phone Clip Table Holder 360",https://www.jumia.com.ng/generic-tripod-mount-adapter-6.8-cell-phone-clip-table-holder-360-184974131.html,"₦ 29,917","₦ 57,834",48%,2022-11-03 23:31:24.577581
38,GE779EA38SU9VNAFAMZ,"10"" Live Ring Light LED Ringlight With Tripod Stand And Phone Holder.",https://www.jumia.com.ng/generic-10-live-ring-light-led-ringlight-with-tripod-stand-and-phone-holder.-195018169.html,"₦ 14,075","₦ 28,150",50%,2022-11-03 23:31:24.782134
39,GE779EA33VZRENAFAMZ,Ocus Mini Tripod Bracket Portable Flexible Smartphone,https://www.jumia.com.ng/generic-ocus-mini-tripod-bracket-portable-flexible-smartphone-185003978.html,"₦ 8,825 - ₦ 9,969","₦ 15,650 - ₦ 17,938",44%,2022-11-03 23:31:24.972280
40,GE779EA2XM6QONAFAMZ,Protable Action Camera Tripod Accessories Stand For Sony Dv,https://www.jumia.com.ng/generic-protable-action-camera-tripod-accessories-stand-for-sony-dv-184849377.html,"₦ 22,110","₦ 42,220",48%,2022-11-03 23:31:25.177133
41,GE779EA2WUBNKNAFAMZ,Funsnap Tripods Tripod For Phone Mobile Camera Holder Clip,https://www.jumia.com.ng/generic-funsnap-tripods-tripod-for-phone-mobile-camera-holder-clip-184849067.html,"₦ 10,018","₦ 18,036",44%,2022-11-03 23:31:25.340013
42,GE779EA33VZRENAFAMZ,Ocus Mini Tripod Bracket Portable Flexible Smartphone,https://www.jumia.com.ng/generic-ocus-mini-tripod-bracket-portable-flexible-smartphone-185003978.html,"₦ 8,825 - ₦ 9,969","₦ 15,650 - ₦ 17,938",44%,2022-11-03 23:31:25.522483
43,GE779EA2CJFAINAFAMZ,"Wireless BT Remote Tripod Blog Portable Live Videos,YouTube Selfie Stick",https://www.jumia.com.ng/generic-wireless-bt-remote-tripod-blog-portable-live-videosyoutube-selfie-stick-162049914.html,"₦ 4,200","₦ 7,900",47%,2022-11-03 23:31:25.699681
44,GE779EA0HBAV3NAFAMZ,Tripod Stand Phone Holder Camera Stand With Remote Shutter,https://www.jumia.com.ng/generic-tripod-stand-phone-holder-camera-stand-with-remote-shutter-76708092.html,"₦ 4,999","₦ 8,076",38%,2022-11-03 23:31:25.861626
45,GE779EA1RN97PNAFAMZ,Outdoor Indoor Portable Stand=Tripod + Mobile Phone Clip + Remote Control,https://www.jumia.com.ng/generic-outdoor-indoor-portable-standtripod-mobile-phone-clip-remote-control-173800960.html,"₦ 6,499","₦ 12,997",50%,2022-11-03 23:31:26.025048
46,GE779EA26J17HNAFAMZ,Portable 360 Degree Rotation Tripod Phone Mount Holder,https://www.jumia.com.ng/generic-portable-360-degree-rotation-tripod-phone-mount-holder-177089813.html,"₦ 3,260","₦ 6,392",49%,2022-11-03 23:31:26.236197
47,GE779EA34C2D9NAFAMZ,Mobile Phone Clip Holder Bracket For Smartphones - Black,https://www.jumia.com.ng/generic-mobile-phone-clip-holder-bracket-for-smartphones-black-133997688.html,"₦ 1,447","₦ 2,400",40%,2022-11-03 23:31:26.426151
48,AR833EA1B1ZOHNAFAMZ,ARHANORY Phone Tripod Stand Ring Light Phones Selfie Stick Live Bracket Spin Desktop Stabilizer Clip Black,https://www.jumia.com.ng/arhanory-phone-tripod-stand-ring-light-phones-selfie-stick-live-bracket-spin-desktop-stabilizer-clip-black-94843097.html,"₦ 1,800","₦ 3,529",49%,2022-11-03 23:31:26.620084
49,AR833EA1KSLUTNAFAMZ,ARHANORY Phone Holder Tripod Stand With Ring Light Selfie Tiktok-Black,https://www.jumia.com.ng/arhanory-phone-holder-tripod-stand-with-ring-light-selfie-tiktok-black-98139359.html,"₦ 2,900","₦ 6,900",58%,2022-11-03 23:31:26.789651
